a597e50502f5ff68e3e25b9114205d4a	yes	I want to reccommend a couple of things to you . The first , is that I want you to know that we have one of the top ten cancer hospitals in the United States right here in Chicago ! The University of Chicago Hospitals' and the Center for Advanced Medicine are ranked 6th best in cancer by US News and World Reports annual rankings of America's bes hospitals . they have oncologists there that work together in teams , and are experts in lung cancer . Dr . Charles Rudin MD PhD specializes in small cell , and there is all kinds of research going on there . Even though you live in the suburbs , TRAVEL ! Trust me it is worth it ! The care is so superb and on the cutting edge there ! If you do not believe me go to and order your free cancer video and learn about how they treat cancer . You seem to be in the early stages and you seem to uusually have some resistance to it because it went and stayed into remission for so unusually long . I want you to have the best shot ! If you ever want to talk , call me after 9pm , at ( 773 ) 817 2494 . I live in the Bridgeport area , ( near Comisky park ) around 35th street , and I am a premed student that is going to go into oncology . See , my mom died of this disease , and i am dedicated to helping others to beat it ! By the way , the other thing i wanted to tell you about is a drug called CPT-11 ( irrenotecan ) which is a new drug that is showing dramatic results in sall cell patients . Please call me or email me at te11t@aol . com I would love to help you . Jonathan
0336dcbab05b9d5ad24f4333c7658a0e	no	@Stewart___O Incompetent officer in Government are DESTABILIZING Duterte Administration ; LTFRB fines Uber and does
084b6fbb10729ed4da8c3d3f5a3ae7c9	no	Montelukast gave our son night terrors and twitching in his leg . It has a bad reputation for side effects . Our consultant agreed to take him off it but not before we increased his preventer medication so that he had son cover . He sleeps fine now . It helps some but the side effects for others are terrible .
85d8ce590ad8981ca2c8286f79f59954	no	Hi so I'm applying to Pembroke for physical natural sciences . I was just wondering if anyone who applied last year or is a student could tell me how the interviews work . Are the interviews subject specific ie a maths interview separate to a chemistry interview or subjects mixed together ? If separated would I get to choose which two out of chemistry , physics and maths I would like interviews in ? Do they give source material/ something to read or anything before interview ? Is there normally one interviewer or multiple ? Thanks to anyone who offers any advice
0e65972dce68dad4d52d063967f0a705	no	Vwry good value for money and good service
84d9ee44e457ddef7f2c4f25dc8fa865	no	Hi Wanda listening to me vent helps I try not to to my family they have so much on them and it just makes them sad . I can't just vent privatelysomething about another person responding helps . I thank you for your words just woke up so getting this in before I feel worse . Over the 33 years I have occasionally told my husband I was not speaking to him anymore . He always laughs and says that is not possible for you . After coming out of my coma I was still on the respirator for several days and it is policy for patients on that in ICU to have their hands tied down I could not communicate I was too weak touse a pencil anyway afterwards he told me he was afraid I would explode from not getting my point across . The point of this it does not seem possible to do short sentence and maybe make u smile . Thank you so much . Tj
3644a684f98ea8fe223c713b77189a77	no	Joe nice pics really well taken . Would appreciate knowing what settings you used and whether you added flash ? Cheers
757b505cfd34c64c85ca5b5690ee5293	no	Oh please , they'll throw anyone under the bus to save their paychecks .
854d6fae5ee42911677c739ee1734486	no	I know where the marks are for the full level . Unfortunately the garage didn't . I couldn't keep the standard dipstick as the Jenvey throttle bodies are in the way . I does need to be addressed , but hadn't at this time hence the garage over filled it . I don't in any way blame them for this .
e2c0be24560d78c5e599c2a9c9d0bbd2	no	This happens when you love your dearones . Whatever you are going through you never want anyone to know about your pains .
274ad4786c3abca69fa097b85867d9a4	no	today will be a great day because we all here are going to be proud of man utd wining rostov tonight at old trafot , united ...
eae27d77ca20db309e056e3d2dcd7d69	no	but the deal here is effciency . Yes the diesel does produce more pollutants , but what would you rather have . A Car that gets 30 mpg on average , or a car that gets regularly well into the mid 40's . Even close to 50 if you push it gently ? Even with increased pollutants when you run the miles down , it's still not a bad deal .
7eabe3a1649ffa2b3ff8c02ebfd5659f	no	I find the statistics about elite swimmers baffling . As a child I was told swimming would be good for my asthma but the chlorine in pools really aggravates it .
69adc1e107f7f7d035d7baf04342e1ca	no	Excellent
091d584fced301b442654dd8c23b3fc9	no	OA is limited to joints , while RA is systemic . It can be in all kinds of places and the longer u live , the better the chances that u will develop the inflammatory process in ur brain , heart , but and other places .
b1d10e7bafa4421218a51b1e1f1b0ba2	no	never heard of it .
6f3ef77ac0e3619e98159e9b6febf557	no	Do u even watch soccer
eb163727917cbba1eea208541a643e74	no	That isn't very good advice . I can't see how it could protect anyone and I hope nobody takes it .
1534b76d325a8f591b52d302e7181331	no	One of the things I've learned about PH is that each patient is unique . Some results in some people are affected by sedation and some are not . What is standard is the RHC techniques and drug challenges used by qualified PH docs . It's a guess whether the Echos and the previous RHC were done correctly or whether they were misread . What matters is what is happening now . You owe it to yourself to see an expert . As an aside , before I got a proper exercise RHC , I was misdiagnosed by two different well known PH specialist docs ( both pulmonary docs ) listed on the PH site . One of them no longer does caths , and the other was on vacation during my cath and had a doc do the cath who only worked in the cath lab . Results were wrong both times and I was referred to a cardiologist who didn't question the findings or my symptoms . I was mistreated for three years for a heart problem I didn't have . Thankfully I found Dr . Daniels !
979d472a84804b9f647bc185a877a8b5	yes	Thanks for your feedback . Please take a few minutes to fill in our survey so we can make sure your voice is heard
ca46c1b9512a7a8315fa3c5a946e8265	no	Jose declared so 2 days ago . What else do you need as proof ?
3b8a614226a953a8cd9526fca6fe9ba5	yes	Then it's a iOS 5 bug , please report this to Apple ) There shouldn't be any cases where the cache isn't cleared when space is needed , I'd say especially when updating/downloading applications . However , I'll keep your request in mind , thanks !
45fbc6d3e05ebd93369ce542e8f2322d	no	hi gents . I'm doing a Part-time job weekend's only ( sat-sun ) 12 hrs shift . and ubering the week days . getting around a grand A ( MONTH ) from the weekend's job . finishing late on Sunday is messing the beginning of the week and starting early on Saturday messing the ending the week . thinking of quieting but hesitating . any opinions . thanks
63dc7ed1010d3c3b8269faf0ba7491d4	no	I will definitely join this challenge . My nape has gotten better now that I treat it separately from all of my hair . It's a different texture completely from the rest of my hair . I usually wear a half up half down hairstyle which leaves my nape exposed but I do my best to baby that area especially during my deep conditioning treatments . I moisturize my hair every two or three days with extra attention to the nape area .
e96ed478dab8595a7dbda4cbcbee168f	no	Used it a Boot's this morning for my Lunch , Worked just as well as my contact cards did . All this really adds in an increased lever of security for transactions . How you doing that with an HTC m8 ? Serious question . @Lou He already mentioned . EE Cash On Tap . An app for EE phones that have NFC that turns your phone into a contactless card . Good job Apple got there before everyone else though ! ( sorry , Apple jab has to be made on the DM )
c0e190d8267e36708f955d7ab048990d	no	Swansea City 0-4 Manchester United Lukaku and Pogba on target for dom #MUFC #ManU #ManUtd #GGMU #FNH
ec8ce6abb3e952a85b8551ba726a1227	no	PhotoVault & VS ( Video Safe ) is what I use ... ( not necessarily for work related purposes tho )
060ad92489947d410d897474079c1477	no	I know . I would be very surprised if he did post any proof .
bcbe3365e6ac95ea2c0343a2395834dd	yes	Drill a 3mm hole through the antennae , plenty of how to on line & also memorise the CVV number on the back then remove it , if you lose your card its harder to abuse .
115f89503138416a242f40fb7d7f338e	no	Nice online service
13fe9d84310e77f13a6d184dbf1232f3	no	the closer it gets the more scared i get , you knew it didnt you !
d1c38a09acc34845c6be3a127a5aacaf	yes	The dent along the sill , yes ? If you can get inside the sill then maybe , but if it's closed box section then is much more difficult . Most body shops have their own dent removal crews anyway ... why not pop in , and mention poverty and cash ? Works for me often enough It's a shame , that ... some careless nerk . John
9cfdf10e8fc047a44b08ed031e1f0ed1	no	Free wifi keep on disconnecting ... and need to login again and again
705f2172834666788607efbfca35afb3	no	I can't see the update x hows he doing ?
74db120f0a8e5646ef5a30154e9f6deb	no	For me duabimall is number one mall in all over the world the best ...
57aeee35c98205091e18d1140e9f38cf	no	Mom your never give up attitude . Your constant love and integrity to everyting you do has made me achieve all the great heights in life as these qualities i have inherit from you . Love you mom for shaping up my destiny , my identity in a positive and beautiful way #shinelikeher Swarovski SWAROVSKI
6da9003b743b65f4c0ccd295cc484e57	yes	If you can , go for it . I hope she understands .
9b04d152845ec0a378394003c96da594	no	@uber this is a First . My driver told me he was sleep and hung up . And I get charged $5 . 00 ???
be83ab3ecd0db773eb2dc1b0a17836a1	no	The height of the squad If we get Matic and Perisic , and keep Fellaini is really incredible !
e165421110ba03099a1c0393373c5b43	no	Sea Breeze scalp Moisturize twists with a liquid leave in ( probably Kinky Kashmere ). These things are making me super lazy . Gonna skretch them one more week . I'm thinking about mixing APB's leave ins with some aloe vera juice and maybe a dab of oil and using that to refresh .
289dff07669d7a23de0ef88d2f7129e7	no	You know , I was just looking at it , and the way the metal wraps the corners , and the thickness of it looks like a first-gen iPhone . I don't think its bad , but it doesn't look like a really sophisticated design .
577ef1154f3240ad5b9b413aa7346a1e	no	Cameron McNeil Are you ok with De Gea leaving ? bcuz that's the only way we'll get more than 1 player out of Real Madrid
01161aaa0b6d1345dd8fe4e481144d84	no	TY for the info Lynnie & Richie . There are no AP drs in NJ ; I am still very weak w/RA , but would travel to John Hopkins on train if AP , ( mino & clindy ), were offered there . Weren't the MIRA studies done thereby the NIH ? Isn't it odd that MIRA clinical studies were done there & AP is not offered there ? I asked rheumy for mino & he agreed ; it is slowly working , but I can't find an MD that administers clindy IV ( in NJ ) to add to the mino & other Rxs I'm taking . Such a shame that patient cannot chose a validated AP protocol w/a local rheumy without much ado & hassle when so ill ...
539fd53b59e3bb12d203f45a912eeaf2	no	I had horrible headaches for 3 days . I took hydrcodone back then to dull the pain . After three days , my headaches became very minimal . I notice if I skip a day from adcirca , I get a headache again , not as bad thou . I am sending positive thoughts your way . I hope it works out .
ac1dd209cbcc5e5d1c6e28598e8cbbe8	no	Bulgar vegetarian main course was weak . We also regretted not being able to have the ""power lunch"" because it was a Friday . Overall , the experience cost twice what it was worth . Maybe next time in the lounge
555d6702c950ecb729a966504af0a635	no	Rogue employee sounds like Joseph Jett , Nick Leeson , Jerome Kerviel ... it's always a ""rogue"", somehow . You'd think the companies would be embarrassed by recycling the stale old story by now . When profits roll in and the stock prices rise following trends , then management ""deserves"" outlandish compensation for their massive ""responsibilities"". But when it is time to take responsibility for actions , curiously it's always down to a ""rogue"" and there was nothing , nothing , absolutely nothing , that management could have done - poor them .
335f5352088d7d9bf74191e006d8e24c	no	It was a good experiance
f340f1b1f65b6df5b5e3f94d95b11daf	no	I use the Lim's half case with built in grip and love it . Here is the link
e4a6222cdb5b34375400904f03d8e6a5	no	+Gianluca XD yeah and if anyone tries to say wallrunning is copying titanfall then technically titanfall is copying mirrors edge .
cb70ab375662576bd1ac5aaf16b3fca4	no	The Uber had a Type C phone charger . What's more legit than that ?
9188905e74c28e489b44e954ec0b9bca	no	The Server is at version 0 . 9 . 11 . 1 and Web is at version 2 . 2 . 8 . I'm not sure which version the BBC iPlayer channel is at but it says it's up-to-date .
0266e33d3f546cb5436a10798e657d97	no	insurance invalid for Stansted pickups
38db3aed920cf82ab059bfccbd02be6a	no	Can anyone explain what Andre Gomes has done to earn minutes over Sergi Roberto ? I mean ... not just so far this year ... but what has he done EVER in a Barcelona shirt ?????
3cec07e9ba5f5bb252d13f5f431e4bbb	no	May also be a way to try and push 4K Bluray sales , in the same way that the PS3 helped to originally launch blurays .
621bf66ddb7c962aa0d22ac97d69b793	no	Both my husband n me are asthmatic n both have two inhalers each so the costs mount up . I believe it is unfair that we should be forced to pay for our medication when people who have other long-term conditions such as diabetes do not .
077e29b11be80ab57e1a2ecabb7da330	no	Love candy crush soda slot better than candy crush saga
6c9882bbac1c7093bd25041881277658	no	#Uber stripped of London licence due to lack of corporate responsibility #investorseurope #technology
19f3cd308f1455b3fa09a282e0d496f4	yes	Hi Manpreet , if you are in the UK and in need of support , please give our Helpline nurses a call , they are on 0300 222 5800 ( 9am-5pm ). We also have a wealth of information on our website that you might find useful
03c6b06952c750899bb03d998e631860	no	anazing really
c24cd76e1ce41366a4bbe8a49b02a028	no	I'm glad you enjoyed that story also , I was really amazed .
c52f1bd66cc19d05628bd8bf27af3ad6	no	Beyond perfect
fe131d7f5a6b38b23cc967316c13dae2	no	the food and beverages in the cinema are over priced its costing more than the ticket it self , popcorn , nachos , cola and sweeties considering that we cant buy snacks outside the cinema .
f718499c1c8cef6730f9fd03c8125cab	no	I was on M1 year 20000 Fast lane phone rings I answered . After phone call , Couldn't remember what I overtook . I thought F6 ( k me I can't remember what I overtook . Phone rings again .. and I answered it ! I thought what a t-t never again .
d96409bf894217686ba124d7356686c9	yes	Chip away at your eating regimen . You ought to set aside an ideal opportunity to reassess your eating regimen . Thin does not liken to sound . It is critical that you adhere to a solid eating routine pro muscle fit . The eating regimen of somebody attempting to get fit may be not quite the same as that of yours . On the off chance that diminishing caloric admission is vital to somebody endeavoring to . .
502e4a16930e414107ee22b6198c578f	no	I have a Nokia windows phone it comes with a app called music mix wvey bit as good as spotify but lat time i looked £4 the free version lets you save 4 hour long mixes off line for free
cfa0860e83a4c3a763a7e62d825349f7	no	How mach this one price onley one
a4f23670e1833f3fdb077ca70bbd5d66	no	Linedancer43Thank you for your suggestion , I will let my Pain management Dr know about the fentanyl patch , and the patch helps some with my other pains , with my low back and upper back , other discomforts but this RA pains , nothing seems to help , I am on the 25mg and I also take oxycodone as needed but I noticed it doesn't do much for this type of pain , my PCP prescribed me a NSDI Drug called Zorvolex , 35 mg twice a day which kinda takes the edge off but I'm a little concern since I had an ulcer before , I am afraid of stomach bleeding , also I have only taken it for two weeks and I been feeling stomach pains already , And I'm scared , but this pain has me against the wall , so I have no other option for now , Thank you for your support ,
b1a59b315fc9a3002ce38bbe070ec3f5	no	Don't people do just plain 'drag n' drop' anymore ? I never trusted iTunes , Winamp , et . al . to do any syncing for me . I'm kinda old school , in which I just do the stuff manually . Plus , I reduce my 320kbps mp3s to 192kbps m4a files beforehand , since I have a lot of music and only a 16GB SD card to work with . Here are the programs I use for the purpose Freeac - converts file formats ( i . e . mp3 to AAC/m4a ) Tagscanner - for repairing/creating ID3 tags using batch methods Then I just open up multiple folders for swapping files . And then I use PowerAmp for playback ( does a very good job of organizing files , at least better than that Mixzing garbage app ).
36660e59856b4de58a219bcf4e27eba3	no	THREE WORD SEASON REVIEW Racheal is bae
8c19f571e251e61cb8dd3612f26d5ecf	no	Online booking is very poor .
d6baf65e0b240ce177cf70da146c8dc8	yes	+thedondon911911 Open your mind and realise what you think isn't always right , just because you have seen a couple hundred comments hating apple products doesn't prove anything facts do and you haven't provided any ... I am going to stop responding because I can't deal with this stupidity
e56954b4f6347e897f954495eab16a88	no	I havent had any freezing issues with Power Amp . Do you think it may be a setting to stop the constant scanning ? I know i turned off auto updates where it scans using data , searching for latest album art , etc . . and i dont have it set where it does any other online or live sharing , etc ?
f7664060cc52bc6f3d620bcedc94a4b6	no	It was an interesting experience , we started on time , we were delayed -( stopped at the border ), at the end of the journey everything was ok . Friendly drivers .
eda80a3d5b344bc40f3bc04f65b7a357	no	okie I'm a little confused . does this help to organise my anime content on my server ?
8f121ce07d74717e0b1f21d122e04521	no	Convenient , comes right after he bash's their board of directors ...
06138bc5af6023646ede0e1f7c1eac75	no	The canula I'm using is very easy and I use the back of my arm between my armpit and elbow , where the fat part is . It has been the best place for me , and I have tried stomach and thigh , hated it . The canula is called the Cleo 90 . Karen
39059724f73a9969845dfe4146c5660e	no	Is anyone out thereeeeee
7f100b7b36092fb9b06dfb4fac360931	yes	The Company also announced that median survival for patients with Stage IIIB locoregional non-small cell lung cancer who received BLP25 Liposome Vaccine ( L-BLP25 ) in a phase 2b study has been determined [ 30 . 6 months compared with 13 . 3 months for the unvaccinated group ]. BLP25 has been taken over by Merck KgaA/EMD Pharmaceuticals under the name Stimuvax . Phase III Clinical Trial to start mid 2006 . I strongly recommend anyone interested in more information or participating go the following link . password vaccine just fill in the rest and your in .
7a614fd06c325499f1680b9896beedeb	no	Hi Spring , The little boys name was Ryan and his Mom was Mrs ...?
4734ba6f3de83d861c3176a6273cac6d	no	Douglas Costa will want to play regularly , why would he come here to sit on the bench ?
d947bf06a885db0d477d707121934ff8	no	Amazing experience .
63923f49e5241343aa7acb6a06a751e7	no	The only missing experience is when reserves online , I'm expecting to collect my ticket at the upper stairs machine ! But I ended up in a line with my other customers buying the traditional way on the box office due to that the machine was not working in the upper stairs .
db8e1af0cb3aca1ae2d0018624204529	yes	Congrats Jamie , you're today's winner ! Please send us a Private Message with the email address associated with your Zipcar account and we'll send your prize .
20f07591c6fcb220ffe637cda29bb3f6	yes	visit our #ebayshop and grab a #quality #barbq today #mufc #manchester #northwesthour
07cdfd23373b17c6b337251c22b7ea57	no	Yep , then the bank will probably bill you 50$ for the ""service"".
d395771085aab05244a4fb8fd91bf4ee	no	Thank you so much for your advice its much appreciated , I've managed to get her an appointment today with the GP for a check and will do the scarf idea on the way there . Thank you again x
92c8c96e4c37100777c7190b76d28233	no	Thanks a lot for bringing this to our attention . We've passed the duplicates on to our content team so they can look into things . We'll update the thread as we find out more )
e3796ae838835da0b6f6ea37bcf8bcb7	no	To me , this is just Sony and MS realizing their consoles are already outdated . 30 fps in 2016 is not what gamers want . Yes , games look pretty , but aren't smooth .﻿
6a9aeddfc689c1d0e3b9ccc3ab651bc5	yes	Do a review/impressions video for the Pebble Time !﻿
0f49c89d1e7298bb9930789c8ed59d48	no	Pele would be about 5 mil
46ba9f2a6976570b0353203ec4474217	no	Well , i'm not saying anything particular about it , am i ? .. no worries , i know )
0e01938fc48a2cfb5f2217fbfb00722d	yes	Hi Manpreet Sandhu sorry to hear that - please look at the medication page on our website for information on medicine
16a5cdae362b8d27a1d8f8c7b78b4330	no	Eric Dier was Jose's first choice , but Tottenham would not sell so Manchester United turned to Matic or Radja Nainggolan [ Telegraph ] #MUFC
918317b57931b6b7a7d29490fe5ec9f9	no	Hi everyone , I am new to PAH . Can you tell me what to expect , or what to do now before things get worse ? My pressure is 30 so I am not severe yet . However , if there is something I should or could do now to make life easier later on , I'd be interested in hearing it . I work 40 hours a week but it is a sit-down job . I am a nurse and don't feel able to do floor nursing anymore . Just making a meal at home leaves me weak and shaking and breathless . I also have high pressure in the left side of my heart which my cardiologist states is a strange combination . Do any of you have that also ? smhoover6 Posted on 07/14/13 , 0634 pm
48aedb8880cab8c45637abc7493ecddd	no	Hi Pat , Did you do bronchoscopy ? Do you know what kind of metastatic cancer is it ? Is it squamous planocellular ? When my dad was diagnosed with Stage 1 planocellular squamous cancer to the lungs i found an info that it's aggressive and really swift . I am sorry to see you here . But remember that you are a fighter , fighting for what you love .
839ab46820b524afda05122893c2fe8e	no	Vapour X is best﻿
f90f2aca5c640289d0a29417bcb63a37	no	Great game
9c838d2e45b2ad1094d42f4ef36764f6	no	The battle between #Google &amp ; #Uber will begin soon .
1700002963a49da13542e0726b7bb758	no	Unfortunately it was unplayable as there was too much lag . I uninstalled it after about 3 minutes (
53c3bce66e43be4f209556518c2fcb54	yes	Lol so which is it I need someone to list everything we got please . There isn't a post about it as far as I know and there should be .
6883966fd8f918a4aa29be29d2c386fb	no	I've unsubscribed from the apple music free trial 3 days after getting it . From the UI to adding music to a playlist it plain sucks . Plus more than one album had mixed live and studio tracks on it .
49182f81e6a13cf5eaa496d51fea6406	no	Read on a forum about lots of people having the same problem as me - I use the free version but only today I had a problem start . A song will be playing and then the sound goes . The song is continuing to play but I can't hear it . If I press the back button to restart the song , the sound comes back . Looks like this problem has been going on for nearly a year - any solutions other than reinstalling ?
d296c101daa88a51f6ca8cfc1ac79b50	no	@Uber_India in Delhi so Many Cab Drivers Use Two Device , ola and uber . TheyNot PickUberCall bcz Ola pay High Commission . UberCustnorsSuffer
9fd81843ad7f202f26c1a174c7357585	yes	Hey , all users who got not working steam overlay issue . If you are using custom Steam skin , you should try to update the skin , or use the default one . If the overlay is still not working , please attach your log files output_log . txt , GameOverlayRenderer . log and the GameOverlayUI . exe . log and DxDiag to your forum post . You can find output_log in ""Dead Island Epidemic_Data"" and ""Dead Island Epidemic - Crib_Data"" folders . GameOverlayRenderer . log and GameOverlayUI . exe . log are located in Steam folder . In DxDiag click on ""Save All Information"" button . If you see ""Run 64-bit DxDiag"" click on it before saving all information and attaching to the post . Thanks .
26e359e83860db1d11b6acca57d8ea88	no	Why not ? Because it would cost millions of pounds . Anyway , whether it's sensible or not , it's clear from what Mourinho said that it's either or , not both .
ef0d3930a7b6c95bd2b32ed45989c61f	no	Great playlist ! Thanks !
94f6d7e04a4d452035300f18b984988c	no	Your welcome hun , I've just done same xx
34ed066df378efacc9b924ec161e7639	no	Jack Webster kronos would squash every ond in the other team and we'd win by default .
