dc6a70712a252123c40d2adba6a11d84	yes	You could maybe give Living Proof Curl detangling rinse a try . On wash day I use a gentle cleanser then apply my conditioner without any detangling . I just smooth and scrunch the conditioner through . Then I rinse and apply the L .P . detangler . The stuff is amazing , super slippy , I can go straight to using my Denman without really bothering using my fingers . Then I just rinse it out and it leaves my hair so silky , ready for some LI . And I lose less hair too . The downside is the price as its expensive , but you only use a small amount and it smells lovely .
71a3cb155f8dc89bf3d0365288219936	no	My brother rather wait over an hour for me then take a like $10 uber home . Idgi
9fe8593a8a330607d76796b35c64c600	no	everything is excellent
ca9c267dad0305d1a6308d2a0cf1c39c	no	+Apple FanBoy you need to be 18 to have de it card . So yes .
fccb3cdc9acc14a6e70a12f74560c026	no	Does it behave better when the engine is warm , and what happens if the engine is under load i . e going uphill ? John
1595af6435015c77a7149e92a551338e	yes	The problem with YB it same problem in PH trade it been saturated to many over supply The problem was back 5 years before uber came lots suburban area application freeze It is not worth it To Do GB it may take extra 18 months but it way way better then anything Your very knowledge driver it help lots when you do the knowledge Was guy over 55 in our school been minicab over 25 years he done it in less the 2 . 5 years ( blue book runs and appearances ) he was good Private message me i will tell you every little secret to do knowledge I used to work for the school when i was in knowledge Points collector It may help No need to pay school fee when you start blue book
08d98638c6fcd194a4b1e6992063e944	yes	First , welcome to out site , we are glad to have you here . Second we are not medically trained unless the writer says so , so take our advice with a large spoon full of caution . Your high blood pressure needs to be treated less your kidneys fail or you have a stroke or heart attack . Please see a doctor soon as that is a real problem .Pulmonary Arterial Hypertension , PAH , is a disease of high blood pressure in the arterial chamber between the right ventricle of the heart and the lung . From all I have read and been told and experienced personally , high body blood pressure has no relationship to PAH . That is one or the other can be high and the other low . Or they can both be high or both low . This is not a disease that you want as there is no cure . The only way to absolutely diagnose it is to use a catheter and directly measure the pressure in the arterial chamber . Then if its over 25 or so , you have PAH by definition . It is a rare disease and it is a high probability as a doctor if you tell someone they don't have it you are right . It is not a disease where you want to say that you do have it unless you have made the measurement . Even an electrocardiogram is only an estimate of yes or no you have it . So Don't stress so much if at all possible . Get your BP under control and then if you are still anxious see a GP and get a pill or two and laugh and be happy . No worthwhile doctor is going to subject you to a heart catherization unless there is every possibility that you do have a problem there . God have mercy on us allKeep in touch and let us hear from you . Best regardsCicero
24681928425f5a9133504de568f5f6df	no	this is the only uber i ever want to take from now on . sorry @chrisromanf
556f391937dfd4398cbac35e050a2177	no	Great Business Venue !
3328bdf9a4b9504b9398284244fe97c2	no	so good to see you post ... We all love and care about you Fay . I'll be praying for you and asking God to give your little fingers lots of typing strength ... Love to you , dear Tami
109a0ca3bc27f3e96597370d5c8cf03d	no	Dubai Mall is my favourite - anywhere !
7f5d04d189dfb634e6a85bb9d9adf21e	no	+Ollie Maiden HLTV is actually the most reliable 3rd party website .
f79921bbae40a577928b76d2fc3edc2a	no	It can be so frustrating ""living"" with asthma x
07a96b1f61097ccb54be14d6a47439b0	no	So , people still care about HBO then ? Hmmm , nobody I know gets it , has gotten it , or is interested . Is it really worth tying yourself down to Apple's closed ecosystem to skip 3 months of waiting for whatever violent frivolity they've come out with most recently ? I don't think this is going to do much for Apple , honestly .
c06d06da9666a219db15cf575aff2824	no	kuro is the best dota player !!!
10a5ab2db37feedfdeaab192ead4ac0e	no	Nobody gets funding for replications . Your tax dollar savings at work !
e555ebe0ce426f7f9b2bef0706315e0c	no	LUKAKU To MAN UTD Instead of MORATA ? MUFC Transfer News #MUFC
53e3a7161e428b65688f14b84d61c610	no	So 5 out of 12 Economics applicants on the stalking page have 99%+ UMS average , what is this madness BBeyond
5487315b1286f907165907aa8fc96619	no	Wooo hooo about time !!! 😀
e4bb4c5173c2ce17fd8fcd40041c068f	no	I wonder if you have to take that combination forever , or you can eventually wean off of it . I'm sad because I have an eye condition that dexamethasone use is contraindicated for , unless it's a life saving measure , so which route do I choose ? Risk eyesight for freedom of pain and joint degeneration ? Hmmmmm
0cb929eae7a499e50248a3a78f7acfc7	no	our uber is british im shook
8a0e1141fd37fa5b98d5bb769ba1a7cc	yes	Mark you should be manager .. seriously you should ! Mou is not putting the best team on the pitch !! That cannot continue . Zlatan would only be sub if he came back .
99bcfcd754a98ce89cb86f73acc04645	no	No I did not count the 11% or the probable full depreciation . So likely £5 an hour net . No wonder my debts keep spiralling .. fml
afd4836712c5e77550897e25711e1d96	no	It is so scary . Thank goodness he is ok Xxx
e5841df2166dd424a57127423d276bbe	no	Challenging game similar to Candy Crush Sage
b4a528955b84f584974e92d025a75d1f	no	Colour version ?
b1eec33c726a60554bc78518d5f9b32c	no	Genius !
d6c651ddcd97183b2e40bc464231c962	no	i'll throw a vote for mixzing ... seems to be the only freebie ive found with an EQ .
f64eac11f2cd8f0efa196f8ad173178e	no	My phone call to the Macmillan Nurse did the trick ! Go in as a day patient on 25th for biopsy . Think you were right in saying shout or no one will hear you . On that day my friend Linda goes in for a Left Mastectomy as it did not respond to Chemo so we will both be in on the same day . We had a ""Cancer Hug"" this afternoon . They have given her a really good Wig , and unless you know you could not tell it was not hers !
4a47d2983c8bd392b120b627e0e1cab4	no	Had forgotten just how lethal Ruud Van Nistelrooy was . Didn't stay in PL long enough imo , one of the best goal scorers of my lifetime #mufc
9c82c7143c102b71c593d98d96093fde	no	No matter how cheap a product - it should work . Like others have said ( I didnt read the reviews before purchasing ) the line snaps off within the spool far too easilly - averaging arounf every 30 seconds or so , even with really careful use on light grass edges . I've owned it a week - will be binning it .
500e75a036dc2d7d2fec5da1b71d36cc	no	Thank you for everything White Pele , it has been such a pleasure to support you for 13 years .. @WayneRooney #MUFC #Wazza
ae0eb3eed39d2bcef4622b2499a05fe6	no	This is gonna sound bougie . I fucking hate uber pools .
1ecfb463472ec9115b10c292ef8bc986	no	But I've gone in and deleted the M3U files . In fact , I've deleted the entire music folder at least twice and started over , and the original playlists are still there . From what I understand , Android keeps a cached list of all the media files ( including playlists ) which is updated by the media scanner . Is that correct ? I'll avoid doubletwist from now on , but I don't think syncing is really my problem . My problem is that android still thinks my old m3u files are there and won't check to see if they've been deleted ...
e70611883d2760c8bbafb4acb29e3446	no	Really , what are they like ?
6081594975a764c8e3a691fa2b3a321d	yes	@BravoWWHL @NeNeLeakes @Andy Just tell her she deserves to get fired from all her gigs including RHOA after tellibg
19bc916108fc6938f52cb96f7e087941	no	My son is 7 years old and has e8 admissions into hospital ... it's a very scary experience for him ... been so tough but he's a strong spirted child xx they always are
07c5807d0d927dcd0980f86024e5208b	no	Christmas idea for who ?
d14220ee66aeec73c49038385428ec4c	no	Josh is there any specific way you should be putting on the shoe like sock like ﻿
8df707a948fac1b4a0f97aa554886ec8	no	This is exactly the stuff thats driving me bonkers ! Not to mention the excessive data Apple Music has been using . If Apple simply came out and said hey we know we're working on it , give it a week . I could live with that . Unfortunately that's not the case probably because Apple is way more worried about the bad pr over a bad service .
e7f8a7fb0b77bcb3b283af5be021448f	no	Great mall
788d986905533aba051261497ecffcbb	no	The suspense is killing me . Just finished , can't sleep . lol
50c3d7614917b24303ee6a220679dab3	no	My post came out wrong , why did E S S I A C come out as NONONONO
2afe4567e1bf64d32a5527244d104cea	no	you sad fuck hahahah liverpool havent won a premiership ever ... sad bastard talking about 5 times europe champions but dont do fuck all and use are shit scum scouse bastards
5f2c22cb4a5380af7ca75622a6426917	no	What is wrong with the controls ? S
aba3b6fd5d186d28e06ff97135cade7f	no	But what do I know . It might be a José Mourinho masterclass incoming ! #mufc #SuperCup
c8ed21db4f678f3b13b9d5ee16489088	no	+THEMrSpectaclesHD you're so dumb , you just agreed to my comment , fucking retard
08419be897405321542838d77f855226	no	I had another look with the car stationary and me pressing the switches rather than asking my wife why she didn't have the lights on !!! The 'sidelights' come on , but not the main beam ones . Also , I can't switch on the full beam lights ( i . e . blue light on the dash board ) , but I can 'flash them'. Does this sound like some kind of wiring problem ? Or has a fuse gone ? I'm glad its getting lighter and she doesn't need to drive in the dark at the moment ...
7f1171a78ce0780a2142a6eb7bc4f3c8	no	Loyalty-then everything follows
82f2b308c3b01637c607ce05f52a2fed	no	Dubai Mall is great , but can be too busy at times
0d3180d672e08b4c5312dcdafdf6ef36	no	Travis Kalanick exercises right to appoint two Uber directors via @WSJ
fb89705ae6d743bf1e848c206e16a1d7	no	Yes . Absolutely .Positively . I have never seen a wedge pressure that high . Unless , of course , that isn't actually your wedge pressure . The information you're sharing with is confusing . Your wedge pressure is either 18 or 37 ? Both are higher than 13 , which is one measure for left heart problems causing right heart failure .
d4c2e4a3297fe25a71d030b67eb83bfc	no	If I love cloak and dagger in MGO and breakout in Halo 5 , will I like this ? It looks really fun .
5751ec3e9a4feab575962e78e006250d	yes	Hi there , I am terribly sorry to hear you've had trouble getting in touch with us . If you are still experiencing issues , please DM me your Deezer account name or email address and I'll be happy to look into this for you .
d5cfead94f5350c12c322b5b664544c1	no	So I didn't take any Doxy (or the other one ) this past Saturday and Sunday ( per usual ).. My pain seemed to subside and go back to ""normal"".. I proceeded with the normal dosage this week , so far ( 2 ) on Monday and ( 2 ) on Wednesday .. Well I'm guessing that is bringing the herx back because my one shoulder is the most pain I've ever felt in it ( usually doesn't give me problems ).. You know that bone that short sticks out up on your shoulder ? Well on my left side that bone is a little bigger than on the right and it is oh SOOO tender .. Possible herx symptom ?? ( I hope )..
59c33016884a62116be975a9bb8257e3	no	I thought you were actually going to act like a watch . ﻿
ba3866600c3540f67c1e9575e213be0a	no	So does Danny Simpson that doesn't make him the best RB .
6c29793a140a811d0c45ce03c1c93a28	no	oh my lord 55 mins and dazzle only died 2 times ...
e995f98d56967d946471af29d7bf99f1	no	What about cold infections that trigger attacks too and stress this isnt caused by allergens . Will this stop attacks for this too do you know .
6cd67d9b6f0150c77bda2eda01ae484c	no	Hi Rob , I've been on Opsumit for 2 1/2 months now . I don't have any side effects . SOB is about the same , but energy level seems a bit better . Good luck with the treatment .
6bc24fc1ab650b25b4114e93a98f1eba	no	I take it there are server problems right now ? Tried 4 times in a row to play MP but each time the screen just gets stuck on smoke in the background and I have to close the app .
a5cdd4aa0048b187f7182f1b9ce7a6a7	no	The colour is gorgeous
217eedd1ba8c592db97d0dbe54c7adfc	no	#ManchesterUnited #ManUTD Jesse Lingard determined to confound the doubters
df263d996281d984952c07998dc54358	no	Finalemente - my application has been sent to my school and will be submitted tomorrow or next Monday
edfbe1afcf9246bb0d40eb4d8027d90f	no	I would think a Dr visit may be in order with a chart of your morning weigh in's in hand . The swelling could be a sign of CHF . I wish you the best of luck . Nothing in the world feels worse then water weight in the abdomen . I am curious if other people find it as uncomfortable as I do !
2e65f2f2fdaf6c699b223c61b1b5ab89	no	Apparently , one dealer has had 15 cancelled orders today !!!!!!! All the cars manufactured now are all clear ... So its reputation and the fact that VW have said nothing about European cars is starting to have an effect . Wow . I'm going back to the dealer who quoted me for an estate to see if he'll still give me £28k for mine , and a better deal on a cancelled R estate ! Somehow I doubt it .
e94550c93cd70fe748e6982b3439ad3b	no	Hi , I have been diagnose with ectopic pregnancy at 6 weeks my OBYGN decide to put me and methotrexate 100mg because of my weight and height and my HCG level was 8800 . After my first shot I felt very hot and my lower left lip was drumpping like crazy . Anyway I was given another dosage on day 4 of which I began feeling tired , sleepy and three days later I felt sever pain which last for about two hours . I stated bleeding on day eight with mild pain in my lower abdomen and left side . Also my vagina has become very sore because of itching , could this itching be some sort of infection ?
5c572eca050594c7bc3c36e7e8ab9550	no	Love the Q tones
0537fb40a68c18da59a35c2bfe1ca554	no	i have=I have all SMG's gold withthe exception of the skorpion , ( Working on it now )
5f0f5e5f33945135b874349cfbed4fb9	no	Great to have you on board !
185e65bc40581880c4f2c82958de8cfe	no	I am interested in knowing symptons , how can I tell if it is the COPD or the P . H . giving me the sort of breath ? Posted on 06/18/09 , 0541 pm
8d317bdcf4aafcfc22149d77babee96d	no	+Julian p I want to know too
e49b8b4053df9505e1f48c3a701c0682	no	A bit much after one match against a dire West Ham side . #MUFC
b056eb1587586b71e2da9acfe4fbd19e	no	Hello all Just a quick update . Mum had a biopsy today but wasn't of her lungs she's still not had one of those . This one was of an enlarged node in her neck . The area around her neck is swollen . Tbikes took 2 viles of liquid from her neck area which seemed to drain the swelling a bit . The doctor doing the biopsy apparently said level 5 and also mentioned something was pressing on her jugular . He also mentioned hashimotos disease . Not sure if that has anything to do with her type 1 diabetes ? Her appointment with the doctor is weds so hopefully her cut scan and biopsy results will be more clear . I just hooe they dont say its spread to her collar bone lymph node . Iv read thats latestage . Much love to everyone
b137fdd1f79d56c7edf3365fea7520f2	no	Does the air conditioning in shops affect anyone else's asthma ?? I really struggle with it . It's the contrast in the temperatures . My asthma has been really bad and I suffer from hay fever .
912d2b1c7b2826caf99687388d2e8f7c	no	Thanks im worried abot messing up the water freed and getting the plastic trim off
a1d33d0dfec820b41b54430b50e96b5c	no	this money theses days are stupid . courthies of Chelsea and buffon are better mate
6f2268bd1d3d3ebaabb04d6b5d099425	no	Had it for a year to keep lawn edges and such neat and tidy . It does this really well . Its light and easy to use . It won't take on any heavy duty work . But then its only 20 quid .
872488f88d1b2db54d55bc8bba2fad1b	no	Diddums ? What are you , four ?
ccb0989662211f61edae2e26d58ea92f	no	Damn I just got this from Best Buy for $40 . Now after reading through the latest posts I'm not sure I should open it .
2823f4797102ce1a1aec05359cc16dd9	yes	Always feel good but this time food court area at week ends requires more attention Also food outlets serving fast and partially cooked foods in food court area
470e7a4f017a5476afb7eeb3f8b96f9b	no	Shiet bro ! i got gold too ) but i haven't got it yet to my inventory ( fucking volvo ... gaben hates me D﻿
bf62768ca46b6c3b5bea9515d1a1fc45	no	FANTASTIC NEWS>>>>>>continued prayers for more good news for Lucie and you !
fa14d4fe2f19414de3ebd9f63d5c0169	no	which sites do the live streaming besides the occasional yahoo ones ? im a huge hockey fan and was just wondering .
2ca65f58e35d9ad45bf7f3ae5cfd08f1	no	Damn @uber my first uber today told me he didnt want to go where I was going so I had to get out and now this guy
88ae6372cfdc5df69a976e893f4d554b	no	Kevin Crotty Ronaldo did not dive you idiot ... you can see the replay , there was contact .. he was pushed ... but the reff ... the referee was worst ref i have ever seen ... he truly was working for Barca today ...
06997f04a7db92466a2baa6ebc8b872d	no	Thanks for the response ! This is something I did not download through iTunes -- it's an imported MP4 file . 0
eefc9e10ebdc4a2333b42b2dbb8f27b6	no	Would happily have Hughes start every game now . Not an overreaction he was that good , uber comfortable .
5807a685d1a9ab3b599035bc566ce2b9	no	I liked the schedule , the pricing , the comfort of the bus , the drivers were super professional , application and emails from customer service were very helpful .
d840cc5d906c3e9c84374c8919d2074e	yes	Thanks for your comments , we really apprciate them and are a great help ! For any questions please call our Helpline nurses 0300 222 5800 ( Mon-Fri . 9am-5pm ).
959a557f5f6beb411fd954f3f34b21c3	no	I was trying to listen to the Chiefs home opener on 101 the Fox Suday . I too had MMS links . Could not get them to work at all on my MyTouch . I had to use a Windows Mobile (Dash ) to listen to the game . When I typed in the MMS to the browser , it automatically opened Windows Media on the Dash and worked beautifully . Does anyone know of an app that will play Windows Media files ????
f2201f5191c4e92cc5af043eebfd0946	no	Hi Cathy , yours is already on there .
3a835d3215755c435ef4fe9965a3f2a0	no	Still have this LP
288cc0ff022877bd3df94bc9360b9c5d	no	Good read
4ea06fbc83cdd0a06020c35d50e1e89a	no	You cleaned the injectors ? May I ask how exactly did you clean them ? I hope you're going to say you cleaned the body of the injectors and not the nozzles .
b7ee6f5f9aa5cd17ca1aea43ce848496	no	and season ends winning nothing ????
e57c6b956a6521b28495f2886ca0977a	no	Not sure who told you it wasn't , but I sure hope it wasn't a doctor . All autoimmune diseases in general are all hereditary . My rheumatologist explained that even though I'm the only one that has RA , that doesn't mean I'm the only with an autoimmune disease . My aunt has fibromyalgia & my grandma had diabetes .
86b122d4358357d834a87ce618a55de0	no	There was a time that watching apple keynotes were so exciting ... I mean they used to show so many new and innovative things . when they announced ipod nano ... WOW , or MacBook Air ... WOW ... or iPhone , iPAD ... there always was something that you were eager to get your hands on ...! I still remember the feeling when they first announced MacBook Air ... man ... there were the times of excitement ... But now ... I watched the entire keynote ... there is nothing exiting there ... iPhones are just blown up versions of what they already have ( and the guy says the display ""is packed with incredible innovations"" and people cheer when they announce the new iPhone 6 is only 6 . 9 millimeter tick ! ( btw there are smartphones only 5 . 5mm thick !)) ... even Watch is not something I want to have ... there are more innovative and exciting products out there already ... I'm sure they'll be selling iPhones and Watches like hotcakes but that's not the point ! Apple is not exciting anymore ... there is no innovation ... there is no genius left ... and that's such a pity for a company once so many people looked up to ... such a pity ...﻿
4e0928de075538c593fbdabb0c5ef2c3	no	Thanks . So far my bottles haven't overlapped enough to do that . I get the new one a day or two before I have to start using it . I'll ask the pharmacy about it when I call .
c0f168ce8900fa56e57789e2a2f2c9d0	no	I came 06/03 with a visitor and we had a wonderful time , Your Manger is a credit to your staff and making the experience even more special ! ( Business card at home so I've forgotten her name , same manager on both occasions ) She even helped to get us a chocolate martini ( which were so Yummy ) Fabulous experience and I'm recommending to all my friends to take their visitors too . %0AI came Sunday Night 20/03 with 2 more visitors and they truly had a great time , One had a really dusty Red wine glass but once this was brought to your attention your staff were wonderful and brought her a fresh glass and gave us 2 lovely treats ( Fruit Platter and the gorgeous and equally yummy Swan ) Can not thank you for making these 2 sets of friends have a wonderful treat and experience the amazing views from the Burj Khalifa . %0AIm sure to be back again )%0A%0AThanks Rachel
8c6744c9d42ec2cb9e8885b54ff744d0	no	Uber's claims of Rate Cuts leading to Higher Earnings are a complete fabrication . The real story of what happens with Drivers Earnings is told by Uber's Craigslist Ads . This is after Jan 9th Rate Cuts .
f1c1592588411002af340cbaedd6fc33	no	Thanks for this . I would of probably have not seen this . I always like new mobas/ mmos .
e07413354875be01a996dc560274708e	no	30 years to .. I kid , I kid I guess it depends on your hair type and personal beliefs . Some people like it , others think it's the Debil .
67d96d458abdef21792e6d8e590244e7	no	A mate has a '98 Beemer with the in line diesel six ... it does exactly the same but calms down with the more expensive fuel . Who knows why for sure , but a replacement injector plus coding makes the job uneconomic so the better fuel it is ! John
a8e864d04c95572d1aece099af852d0a	no	I'll be banning the ▄︻̷̿┻̿═━一 just for pmaj )﻿
7143d7fbadfa4693b9eec507d9d37443	no	Hi all . I was diagnosed with Rheumatoid Arthritis a little over a year ago at the age of 40 . Since I also have Fibromyalgia ( since 1993 ) and Upper Airway Resistance Syndrome , I now have three conditions that can cause fatigue . Along with the fatigue , I experience ""brain fog"" which is making it very difficult to perform my job functions as a teacher . The Dr gave me Provigil to help get me through the day , but I don't see this as a very good answer , nor do I like taking such meds . Does anyone here have both RA and Fibromyalgia ? If so , how have you treated it ? Brain fog - How have people dealt with this ? Thanks !
72da7fd6d1302c0a159f6436d01e9eb0	no	Well , good luck either way , Debbie !! An hour drive isn't too bad , unless you are going in the middle of winter and there is a snowstorm . lol
6e0721b2c6977135b916ef286bcb49ec	no	The edit is wrong you cannot use the 5s for Apple pay
fc8001f834f6a5f0561080d134d53d29	no	That shows a lack of experience . In a court case there is never ever a 100% chance of winning .
4b04a686b0ad13dce35fa99fa4161c65	no	No , they shouldn't . It's not a sport .﻿
61b4a64be663682e8cb037d9719ad8cd	no	Ohio has some nice venues . We have Columbus . But Cleveland is really the place to be venue wise ... Cleveland has Quicken Loans Arena A Convention Center where the Republican Convention is being held . And the Wolstein Center All within walking or a short cab ride And we have a convention center where there can be booths , smaller shows/stages/etc . With the main event/finals being held in the large Q arena . PermalinkSpeichernÜbergeordnetmeldenSchenke Goldantworten
3621f1454cacf995530ea53652ddf8fb	no	Rachel Marie thanks ! He's been out today with Eoin , but he's fine but I'll keep him in till this passes xxx
c15da1f2b5e5ed6e6837a3802f0d1593	no	@agustcurls you listen to british grime without being british and i still find it the most amusing thing i rmbr dyi
68053af2923e00204c3ca7c6a3150cf7	no	My cath showed mild PH but no cardiovascular disease .
2dace78f80bc92e6d7493423d729448e	no	+antonpixel They have a device which you tap your phone/watch against . Just like with Oyster .
df7f28ac89ca37bf1abd2f6c184fe1cf	no	+doomtomb3 nope , I don't own any iOS device ( except a very old iPod Touch ) so this is even more useless to me .
96ea64f3a1aa2fd00c72faacf0cb8ac9	yes	Omaha rocked bc of free taxis ! Nail it w the STEVENT1811UE promo code on Uber to claim free rides . Beats Lyft anyday . Mega promo . #ad
da8ce53cf0240070ce6c69c48cd588ee	no	I've been going through my supplies . Tomorrow is the big date . This time , I going for the max time . I don't think that texlaxing is helping my hair . I need it to be straight ; less breakage when I comb during the stretches .
82489c9737cc245530c7a6ebef3753ec	no	I played that back multiple times in a row . Damn fine !!!
7c590f01490190db0ed02a5070e20f01	no	Same here past few days feeling sniffly and asthma not great
35cf8659cfcb13224cbd47863a34fc58	no	For the first few months of taking methX I had awful GI trouble . Now I'v been taking it for about three years and the side effects are very minimal .
