c4ca4238a0b923820dcc509a6f75849b	no	Hi Robert , that was my first stop , and unfortunately the ""HONDA"" dealer can't even order the parts because they are no available , I wish it had been that easy , but thanks for your feedback .
c81e728d9d4c2f636f067f89cc14862c	yes	Join us for a drink and discount off your ride home . Just download uber and use our code GARAGEBAR ??#mcr
eccbc87e4b5ce2fe28308fd9f2a7baf3	yes	But you're not , so ... Stay home
a87ff679a2f3e71d9181a67b7542122c	no	I've heard of it but don't know anyone who actually did it . My neighbors boss did it with great results but I only know that through this neighbor and I have no idea how he went about getting bee therapy .
e4da3b7fbbce2345d7772b0674a318d5	no	Everything was absolutely fine , keep up the good work ...
1679091c5a880faf6fb5e6087eb1b2dc	no	Right . And it will be the same for Android TV once it is out of beta . Same thing is happening on Xbox 360 and PS4 . Thanks , I hope that is the case ... I don't mean to sound like a troll , or a hater , but just a little disappointed at the moment . I paid 1 1/2 times the amount as i paid for my roku 3 over a year ago , and this thing ( the nexus player ) literally pales in comparison ( ATM )... but i guess i am betting on the future . A big part of the equation , for me anyway , is streaming my files from my computer .
8f14e45fceea167a5a36dedd4bea2543	no	Well as you all know the time has come where my dad has his series of scans starting tommorrow to find out if the pain in his back is cancer or not . And to see if it has spread anywhere else thoughout his body . Im soo terribly scared . I just dont think I can handle seeing him go through all the treatments again in fact i dont think he can handle it . Hes told me that he doesnt want to do it again . His last chemo was 6 months ago and now it might be starting all over again just when things seemed to be getting back to normal . I guess i always knew they werent normal i knew he still had cancer but its like i forgot about it you know ? in a way .. I coulld keep rambling about this and all my emotions and thoughts going through my head but Im not .. not for now anyway because i know you guys will help me though the outcome so until then PRAYER BELIEF AND AFFIRMATION will do . I just hope that I can post the outcome in the GOOD NEWS section I have always wanted to . =) anyhow prayers to you all ... thinking of this board always !
c9f0f895fb98ab9159f51fd0297e236d	no	It doesn't take high skill like you claim it does , you usually have set harass combos you tend to do and getting ganked in LoL isn't as difficult to survive as in DotA as the lanes are smaller , tower diving is harder and you have access to more wards . Not to mention smoke of deceit makes ganks even harder to survive in DotA , and you might easily find ganks set up in a way where one of the gankers is comming from behind the mid-lane tower , making escape a very hard thing to do .
45c48cce2e2d7fbdea1afc51c7c6ad26	yes	Guys , with the new concede option , all you gotta do is wait 5 minutes after the start of the match and you'll be able to bring up the concede vote . Please think sensibly , would you rather wait 5 minutes , or another 15 minutes or more for the next game ? Go and get a drink or something while waiting for those 5 minutes , geez ...
d3d9446802a44259755d38e6d163e820	no	No , not yet . She's scheduled to see her orthopaedic surgeon again tomorrow to check her progress - we're hoping he will say the bones are knitting and that she can start trying some weight-bearing physio . And then she'll see the chest surgery team beginning of next week . In an ideal world I guess they wouldn't operate until she's fit and well again , but it's likely to be at least another 4 months before they take the frame off her leg , and I can't see them leaving the cancer in situ that long - I don't know what rate it's growing at , but seems to me the sooner it comes out the better ! I've got the number for her chest team , so I was thinking of calling them directly and seeing what information I can get . She's quite bad at taking in all the details - or passing them on to us . I'd like to hear from the doctor how much lung she will lose and what the surgery will entail . Just need to work up some courage ...
6512bd43d9caa6e02c990b0a82652dca	no	Do these leading doctor's know how many people are killed each year by asthma ?
c20ad4d76fe97759aa27a0c99bff6710	no	When is the game going to start in Ghana's time pls
c51ce410c124a10e0db5e4b97fc2af39	no	My son goes to school in September and I'm so scared . Definitely my top priority when I meet the teacher at the opening evening x
aab3238922bcc25a6f606eb525ffdc56	no	Waiting For Real Madrid C . F . vs Leicester City Football Club
9bf31c7ff062936a96d3c8bd1f8f2ff3	no	techies is really powerful . the role of techies early game is to get as many kills as possible , and force the supports to buy wards . late game techies is an awesome base defender . strategically placed mines will decimate creeps before they even touch your tower . the greatest counter to techies is gem but getting one is a pretty big investment .
c74d97b01eae257e44aa9d5bade97baf	no	Can you watch live TV thought it ? what channels can you get live ? I have a now redundant tv upstairs as no wall aerial socket and I can't get freeview with a set top aerial . If could buy this box for £10 and use it to watch tv upstairs it would be worth it . thanks
70efdf2ec9b086079795c442636b55fb	no	Lemon essential oil to mix into my deep conditioners Matrix Biolage Hydrasource conditioner because I could only find Nexxus Humectress in the concentrated protein and not the regla one
6f4922f45568161a8cdf4ad2299f6d23	no	Lol long shot but worth it haha
1f0e3dad99908345f7439f8ffabdffc4	no	Big hugs to you all ... It is such a truly awful time when loved ones are going through such an awful time ... My dad was diagnosed in feb , has completed radiotherapy and begins chemo next week and in amongst all this we are waiting results from my husbands CT scan as a routine chest x-ray showed a shadow on his lung ... From both men being so fit and active the change in them is so sad to see ... With this being my family's first meeting with cancer it's hard not knowing what's happening and why ... So many questions ... Hope u all take care x
98f13708210194c475687be6106a3b84	no	As a window cleaned its a great tool to use when collecting money , as people don't always carry cash .
3c59dc048e8850243be8079a5c74d079	no	how much n bracelet
b6d767d2f8ed5d21a44b0e5886680cb9	yes	U skipped No . 2 so I assume based on No . 6 answer you never done mini cabbing or private hire jobs ! First to get to Exec stage ( I call it posh minicab ) you need to have at least 3-4 yrs and some TfL miles under ur belt . As I said , it'n not about car . It's about you . Along the way u ll pick up pax habits , requests and other things . Then u ll learn how to react in each situation . On top of that u ll need to know history of London and surrounding areas , castles , villages and so on . Why am I telling u this . Coz on one click of a button anyone can see how long u work as ph driver and what's ur expirience . Someone who pays a bit extra , is waiting to get that extra back and if u fail once or twice , no job for and ur Exec car . If u think u gonna make big money , do not listen to others coz they r trying to impress you and they try to be better than you hiding their own failures . Please , you sound young , do not relay on Uber and do not dream about Uber Exec . Now , fastest depreciat ...
37693cfc748049e45d87b8c7d8b9aacd	no	hey I am super excited about he new Google music service but since i don't live in the US i have to wait a bit longer but all in all it cool . I have a question when i upload my itunes library to the music cloud let say i change my mac ; can re download it back to my new mac instead of transferring by a memory stick
1ff1de774005f8da13f42943881c655f	no	Ubers new Asia chief wants to work with governments and taxi firms not against them
8e296a067a37563370ded05f5a3bf3ec	no	Fantastic service%0AKnowledgable and friendly staff%0AAmazing food
4e732ced3463d06de0ca9a15b6153677	no	ive managed to get an album in my bag ... just got to try and checkout now
02e74f10e0327ad868d138f2b4fdd6f0	no	Good post Cilla . Regardless of age or current condition , I think this is something we should all consider .
33e75ff09dd601bbe69f351039152189	no	Love it ❤️🔝🎵
6ea9ab1baa0efb9e19094440c317e21b	no	Over 3000 trips and I never had a issue with getting passenger to their destination it was there on the sat pick up From a drop of at b simple as that but it will be good for older drivers that have been in the trade for a while = less drivers on the other hand those older drivers will soon be unemployed because they can't speak English
34173cb38f07f89ddbebc2ac9128303f	no	Excellent pedicure at sisters%0A%0ALovely food and service at cafe Nero and costa
c16a5320fa475530d9583c34fd356ef5	no	SPORT claims Barcelona will target #ManUtd's Ander #Herrera and #LCFC's Riyad Mahrez if they can't pry Marco #Verratti away from #PSG .
6364d3f0f495b6ab9dcf8d3b5c6e0b01	no	The fact that Wayne Rooney's #legendary status in #MUFC has been called into question is a shame he has a presently unmatched record
182be0c5cdcd5072bb1864cdee4d3d6e	no	Sorry android users , but apple just killed you in this whole smart watch . You can say whatever you want but it's pretty clear that this is a hell of a lot more useful in so many ways ﻿
e369853df766fa44e1ed0ff613f563bd	no	Dear Jojo , I know exactly how he feels . I was first given a cancer diagnosis in april 2012 and didnt recieve any ""treatment"" until september ( 2012 ), the best part of six months later . All I wanted was to get stuck into treatment but all I seemed to get was one biopsy or scan after the other then a final attempt at surgery before they finally set me off on chemo . Frustrating as it was I have to accept that the reason was to try to ascertain the ""precise and exact"" cancer they are going to treat . In my case , the cells from the tumour on my lung gave a ""medical indicator"" that it had originated , biologically , in my gut and my oncologist needed to be certain he was treating the primary cause rather than the secondary . So he spent some time with endoscopies and scans looking for something he never did find . However , if it had been there and he had missed it then things could have been far worse for me than the delay caused by the search for it . Be assured , there is no system based on ""how someone reports how they feel themselves"". I have hardly ever felt better in my life than I do now (or happier ), yet I am now on palliative programme with a terminal diagnosis . This is far from a logical illness but you and your father have my understanding and best wishes . Tones
1c383cd30b7c298ab50293adfecb7b18	no	@Gingergyalll Why you come for me like that ? ??
19ca14e7ea6328a42e0eb13d585e4c22	no	I HAVE TICKETS
a5bfc9e07964f8dddeb95fc584cd965d	no	I can't see myself xD i'll make sure to video bomb this year !
a5771bce93e200c36f7cd9dfd0e5deaa	no	I love you Hilary duff I be . Mummer you did Lizzie on dinsey . I love . To see you . Back in 2001 on Lizzie . Told your son that you are on Lizzie . Show on Disney I love your album back in 2003 to 2007 . Wow grill
d67d8ab4f4c10bf22aa353e27879133c	no	I am quite sure that Chevrolet sell a diesel version the Cruze , at somewhat less than 70k .
d645920e395fedad7bbbed0eca3fe2e0	no	Hi juniepoonie , thinking of you both & hoping you get good news . Love & hugs , Twirly xxx
3416a75f4cea9109507cacd8e2f2aefc	no	I've had that happen once before and my mom seems to think that the swelling putting pressure on the nerves or whatever might have caused it . It happened in my pinky finger .
a1d0c6e83f027327d8461063f4ac58a6	no	@omerozener @Uber_UAE @CareemUAE Careem used to have the same issue , but they listen to their customers . They've so
17e62166fc8586dfa4d1bc0e1742c08b	no	As a frugal person , this interests me greatly . I only listen to about 10-15 songs a day so the 25 song cap is suitable . Plus , they're offering a generous 60 day free trial . I think a lot of others like me are going to sign up for this .
f7177163c833dff4b38fc8d2872f1ec6	no	Fabulous mall I have ever seen .
6c8349cc7260ae62e3b1396831a8398f	no	Ill wait for the 4 . 6
d9d4f495e875a2e075a1a4a6e1b9770f	no	Whilst I accept technology is moving on , sometimes there's no option but to use cash to pay bills in the branches ( I had a row with an O2 branch in Penzance , who offered no alternatives ). I utterly resent the big companies trying to remove my right to use legal tender when needed . All this excuse about money laundering etc is used just to make money and control the market , and does not serve the average customer . It is disgusting !
67c6a1e7ce56d3d6fa748ab6d9af3fd7	no	I have had asthma for nearly 50 years . It drives me mad when people think you're 'just a bit short of breath' when you are struggling to breath at all . When I first married my husband he didn't understand asthma , as his mother used to have panic attacks and over breath . He seriously thought I was doing the same thing . It took about 4 trips to the hospital in an ambulance on oxygen till he finally realised it's actually a frightening experience , not being able to breathe . He has COPD now and a couple of times he has had it so bad that he was struggling to breathe , now I'm pretty sure he understands me .
642e92efb79421734881b53e1e1b18b6	yes	My heart goes out to you . Only you and your family can make the decision and as long as you have come to terms with it no one has the right to criticise you . I for one never judge anyone's decision on anything because this horrid disease effects each one of us so differently and throws up decisions that we have to make to suit us and no one else . Just remember we are all here to support you when you need us so please reach out to us for that support . That is how we work in the PH PHamily . Aussie Joan
f457c545a9ded88f18ecee47145a72c0	no	@IDareT'sHair and @cynd ITA - 6 months is absolutely necessary to see results with Viviscal and I believe with any other hair growth oral supplement .
c0c7c76d30bd3dcaefc96f40275bdc0a	no	Very happy with product but I only have a small garden so not sure on how long the batt will last but would would rec .
2838023a778dfaecdc212708f721b788	no	Saw these this morning , there pretty
9a1158154dfa42caddbd0694a4e9bdc8	no	Fifa is better . PES is all hype . Year in year out . It's been very mediocre ever since the Winning Eleven days . Even the Fifa cover is better .
d82c8d1619ad8176d665453cfb2e55f0	no	All much better now thanks , had a lot of stress pre-Christmas too so think it was a combination of that & the weather . I also have regular check ups with Asthma nurse at the doctors ?
a684eceee76fc522773286a895bc8436	no	Best game ever
b53b3a3d6ab90ce0268229151c9bde11	no	I'm a day late here Christy ! But .. yeah . I do that a lot . Even with 3 meds for high blood pressure . I get up slow or suddenly .. still does it . I've yet to see a lung Dr . Gonna call one for an earlier appt than they have me set up for . For July 31 . Don't want to have to wait so long . Piddler55 ( Jackie ) [ img ] Previous discussions I participated in SVTs and PH
9f61408e3afb633e50cdf1b20de6f466	no	I still don't believe this will happen and I won't until some official news .
72b32a1f754ba1c09b3695e0cb6cde7f	no	I wasn't hype for Ghosts or AW but I'm hype for this game .﻿
66f041e16a60928b05a7e228a89c3799	yes	Sherry ... go on ssa . gov for more info . You have to wait 2 years for medicare Dolly . There are pharm assistance companies that you can appky to . I get my Orencia for free .
093f65e080a295f8076b1c5722a46aa2	no	+FuelledByFIFA I most likely won't be bringing those in .
072b030ba126b2f4b2374f342be9ed44	no	Is anyone else unable to access the game on uplay to see overall stats ? Using the app on android .
7f39f8317fbdb1988ef4c628eba02591	yes	Works well I have used this app at Walgreen's and Trader Joe's and have not had any issues with it not working . Just wait until you hear the beep before you move your phone . Full Review
44f683a84163b3523afe57c2e008bc8c	no	Thanks , Miranda Zhang . I didn't adjust the colour , only the highlights and shadows .
03afdbd66e7929b125f8597834fa83a4	no	He bottom fragged for 2 matches
ea5d2f1c4608232e07d3aa3d998e5135	yes	Pasha come here .
fc490ca45c00b1249bbe3554a4fdf6fb	no	One woman's journey to learn to live life from a place of gratitude while fighting Rheumatoid Arthritis . wow inspiring ! Thank you . ""In our daily lives , we must see that it is not happiness that makes us grateful , but the gratefulness that makes us happy"" -Albert Clarke Post a Comment
3295c76acbf4caaed33c36b1b5fc2cb1	no	Awesome , I hope I will see more of NA in the future !﻿
735b90b4568125ed6c3f678819b6e058	yes	Make it £55 and its a deal
a3f390d88e4c41f2747bfa2f1b5f87db	yes	Welcome to the club Earl  but I am truly sorry you had reason to find us . It appears that once you sought medical help things moved pretty quickly . It also sounds as though the chemo is working , and that is a very good thing . I have non-small cell , but we have many members who , like you , have small cell and if you havent , you may want to check out the posts under small cell, as well as posts under the good news tab . Please ask any questions you might have about treatments , side effects , etc . There are members here who most likely have been just where you are . I found the best thing I could do while going through treatment was to pace myself , getting plenty of rest , and drinking lots of fluid . Please come back often and let us know how you are doing .
14bfa6bb14875e45bba028a21ed38046	no	i got a key today thx p
7cbbc409ec990f19c78c75bd1e06f215	yes	My dad was given a break too when his scans revealed only a very small evidence of cancer in his left lung and and the two small lesions on his liver . I hated the fact that he wasn't getting chemo and that it might grow back double in 30 days . I was scared to say the least , but his body need a break and he had gotten so sick . The Dr . gave him another scan in 4 weeks and the cancer in his lung was GONE and the liver mets were very small . My dad got to enjoy a three 1/2 month break and recouperation period before his recurrence in March . Point is , you never know how a person is going to react to after treatment is over , or during a break , or if the chemo continues to work . Just consider what the Dr . is saying , and know that it can be beat if it is closely monitored . Second opinions could not hurt , then again , maybe her doctor could monitor with x-rays inbetween the ct scans like my dad was . I am SO HAPPY your moms results were SO GOOD ! I will continue to pray that they stay good and only get BETTER ! (( HUGS ))
e2c420d928d4bf8ce0ff2ec19b371514	no	What gave it away ? The black stains running up the back of the cars ? Lol
32bb90e8976aab5298d5da10fe66f21d	no	Interesting . Thanks for the insight , I will contact Apple ASAP . And as for the song I'll try to make it happen and finish it , thank you for the random act of kindness and inspiration !
d2ddea18f00665ce8623e36bd4e3c7c5	no	I noticed my scalp has been dry and itchy lately too ! My feet are fine thankfully , I love sandals lol . I had no symptoms until now . Figured my uti meds would clear it but it got worse so I knew it was something else . /
ad61ab143223efbc24c7d2583be69251	no	1k for 70-84 hrs a week is NOT good , are you mad ? Its 10-12 hour days .
d09bf41544a3365a46c9077ebb5e35c3	no	I want viewfinder for shooting , back screen for review and menus
fbd7939d674997cdb4692d34de8633c4	no	I was on Mtx and Orencia weekly injections and had horrible side effects . My Rheumy suggested I take Folic Acid because it biologics can cause hair loss . I'm no longer taking those meds but still take Folic Acid .
28dd2c7955ce926456240b2ff0100bde	yes	80 is bad . Below 88 qualifies for supplemental oxygen . If you're not on it , you should be . Flying will only make it go lower . The plane is pressurized to about 8000 ft . That means there's a lot less oxygen in the air . You'll need to rent a portable oxygen concentrator from a service that supports international travel . Read the article below for more info .
35f4a8d465e6e1edc05f3d8ab658c551	yes	AFriend6 , Welcome back by very sorry that your friend has taken a turn for the worse . Watching this unfold is very sad . I'm not sure why the doctors would tell him that this chemo will be much worse . Have they changed the chemo ? Do you know what kind he will be on ? Please keep us posted on how he is doing . God Bless . Irish
d1fe173d08e959397adf34b1d77e88d7	no	American systems work rather differently to UK ones , as ours usually require authentication in the form of PIN ( except with contactless ), rendering any swipe stuff pointless , as it would only take longer . Of course the NFC part of Samsung Pay will be great , as it will be supported all over the place , just saying that America's antiquated systems make the magstrip simulation far more useful there
f033ab37c30201f73f142449d037028d	no	Since Apple Music came out , certain songs have small , high beeps that go along with the rhythm of the songs . It is most prominent with piano notes . It does it both when listening on my IPhone and on the PC . I think it might be the song file itself . Has anyone else had this problem ? Can anyone suggest a solution
43ec517d68b6edd3015b3edc9a11367b	no	I've just been diagnosed with early on set asthma I'm 44 . I went to the doctors this am with a wheezy chest and hyperactive cough early am . ?? don't know where to turn . My mum and nan have both got asthma too and have been told it's hereditary ?? x
9778d5d219c5080b9a6a17bef029331c	no	Took my twists down with Curl Junkie Smoothing Lotion Prepoo/Protein Curl Junkie Repair Me ( 1h ) Clarify Redken Cleansing Cream Moisturizing Shampoo Blended Beauty Soy Cream Dc Silk Dreams Avocado ( 2h ) Twisted with Soultanicals Marula , Annabelles Ayurvedic Cream and My Honey Child Type 4
fe9fc289c3ff0af142b6d3bead98a923	no	Lol I never saw Neymar as a PSG player but that happened lol . Although bale joining barca is like the most impossible thing ????
68d30a9594728bc39aa24be94b319d21	no	Dissertation update hungover and in an uber .
3ef815416f775098fe977004015c6193	no	I think it is worth pointing out that for longer lenses , you may suffer from vignetting with stacked adapters , due to the restricted throat of the XXX to M adapter . You pays your money and takes your choice - Stacked or Dumb . I hope that the FW might be changed in later iterations , so that we can access the R lens menu manually but I would not hold my breath .
93db85ed909c13838ff95ccfa94cebd9	no	Rabbit very good , wagyu steak a bit chewy . Good bread selection and butter . Too much foie gras for one person in the appetiser .%0ARude Armani hotel staff wouldn't let us go to ground floor to exit to the Dubai mall as we aren't hotel guests . We were told to walk all around the building .
c7e1249ffc03eb9ded908c236bd1996d	no	+PTG_St3v3oh Then how the fuck is it the biggest tournement in csgo history ? 0_o
2a38a4a9316c49e5a833517c45d31070	no	What happened bro ? Marlon Lonnie Rangel Escobar
7647966b7343c29048673252e490f736	no	Its been hinted , I hope so , many people from Asia suffer from lags on other servers
8613985ec49eb8f757ae6439e879bb2a	no	Welcome to out site . We are like you in that we don't want to be scared , but PAH is scary , bottom line . You say the RHC was a cause for concern , what was the reading for Systolic and dystolic ? You say the meds don't work but yet you are at work , full time I suppose . My situation is that I have no idea if the meds work as I keep demanding more and more O2 . Up to 7 LPM sitting and sleeping and 10 50 15 walking . The site pain is reported to be irritating but is not painful in the way it would make you cry . Its just always there and you have to accommodate it . I'm on Tracleer and Reviato and some inhalers and the like . I live one day at a time as the future is not so clear . Good luck to you . Cicero Previous discussions I participated in Surgery for my sleep apnea I hate my sleep apnea New here and new to dialysis
54229abfcfa5649e7003b83dd4755294	no	Great stories guys , thanks for sharing . Nothing beats the unconditional love of children and our animals . They dont care about what kind of car you drive , where you work , or how much hair you have . They are just hhappy you are there and that you pay attention to them . I hope and pray we all have many more M .O . M . s .
92cc227532d17e56e07902b254dfad10	no	Best mall in dubi ever i see
98dce83da57b0395e163467c9dae521b	no	I didn't have additional side effects . Good luck and hope your surgery was a success .
f4b9ec30ad9f68f89b29639786cb62ef	no	I mentioned it in a branch . She seemed un-interested and suggested that because im not eligible for a contactless card that i couldnt used apple pay so it was probably cancelled for this reason . My opinion is that Santander knew i was gaining weight at an unusual rate . Having used apple pay to buy a McDonalds they cut off my apple pay in a plea to stop me stuffing my face ... Ive been McDonalds free since . Thanks Santander 👌 Id 972590626164875
812b4ba287f5ee0bc9d43bbf5bbe87fb	yes	The maf sensors fail commonly on these and cause that kind of issue , you can disconnect it and generally the car should run better which proves its cream crackered . Its located on or near the main black plastic air filter housing , if you need help locating it post up a picture of the engine bay .
