ffd52f3c7e12435a724a8f30fddadd9c	no	Sorry , this is really long but I have to get it off my chest My Dad was diagnosed with nsclc a year ago . He underwent chemo & radio and was told at his 12 month check-up that he had another tumor in his lung which was eating into his rib . He reported his headaches & sickness at this point which we had all put down to stress . Consultant said she wanted to rule out anything untoward in his head , so referred him for scans & second round of radio . Week before his radio started I rang him to see how he was & he seemed to be slurring ; Dad's not one to fuss and only when I pushed him he said he thought he might have had a mini stroke ! Frantically got him a Dr appointment who diagnosed Bell's Palsy due to a numbness in his tongue . He was admitted to University Hospital North Durham for tests & obs . Biggest joke is , I came up from my home in Leicester for that week to take him for his radio at the Freeman in Newcastle- I had to pick him up from hospital in Durham , take him for treatment at Newcastle & deliver him back to Durham - all because they couldn't get transport sorted ! 3 hour round trips for a week ! While he was in hospital he had a CT scan , the lung function nurse gave him the results of this as ""all clear - nothing on his brain"" On the last day of his treatment , whilst he was away from the ward in Durham , a porter came to take him for his MRI scan and couldn't as Dad was in Newcastle having radio . Consultant came in afternoon and was visibly pi**ed off at Dad having missed the scan , so discharged him ""as he may as well wait for an appointment as an outpatient"". 5 weeks later and Dad has MRI scan , still no follow up appointment for the results . After ringing the Consultants secretary for over a week , I manage to blag an appointment for Sept 7th . Sept 7th comes , we are told that cancer has spread to Dad's head and is pressing on the Hypoglossal nerve which has caused his tongue to go numb . surgery is not an option due to the risk it carries and the fact that the disease is so aggressive , if they remove the tumor , another is likely to grow in it's place . Chemo can't be given and radio not possible due to the damage it may cause to the surrounding nerves ... Dad asks how long and is told 3mth - 3 year . Consultant thinks Dad shouldn't be getting headaches from the tumor and wants him to have a lumber puncture to test the meningal fluid . ( methinks there may be more tumors up there now ). By now , Dad is hardly eating , at 18stoone Dad not eating is unusual to say the least . Lung Function nurse tells consultant ( yes , TELLS ) to try anti-sickness drugs and not to admit Dad . We leave hospital with script for anti-sickness drugs & told mac nurse will bring morphine . 8th Sept- Dad still vomitting & headache worse than ever . I chase up lung function nurse , she will make sure referrals are done 9th Sept- see above . I call Dad's GP and tell him he needs something for pain , GP calls Dad to say script ready for morphine . 10th Sept - hurrah ! Dad is no longer in pain ! This is the very short version of what has happened . I have quit my job in Leicester , got my flat up for rent to move home at 38 to look after him & Mam who has severe heart failure . I have had to fight EVERY STEP OF THE WAY to get Dad seen & treated . Dad thinks it's because he's 60 and on the scrap heap they aren't bothered and I have to say that despite disagreeing with him face to face , I agree totally . I know he is dying and they can't stop that , but the NHS and their treatment of my Dad ( don't get me started on Mam's experience ) is a disgrace . I know that staff working in the NHS are doing a tough job and are incredible for the most part , but I am so disappointed that I had to air my thoughts with someone other than my fantastic family & friends . PS - any stories on the mts to the brain would be useful . Shelle
ad972f10e0800b49d76fed33a21f6698	no	It was ok except for one thing inwas watching the civil war there was a baby in the cinema who didnt stop crying . Kind of ruined my experience honestly
f61d6947467ccd3aa5af24db320235dd	no	I ran one as a daily driver for 6 years and in that time put 1/4 million miles on it ! It was at the time the highest mileage 4 . 2 V8 that the local dealer had seen . It eventually dropped a cog in the gearbox ( auto ) and cost £2K to put right in order to flog it ( it was touch and go if there was better value in breaking it ) but in that time apart from lots of brake pads , discs , coil packs , a couple of aux' radiators and a mortgage worth of fuel it was as good as gold and the most delightful place to spend hours of my day . I started off using 98 all the time and then once it got up near £1 . 50/litre I went to 95 and never even noticed the difference .
142949df56ea8ae0be8b5306971900a4	no	Muhammed Qaid he'll make you eat your words don't worry
d34ab169b70c9dcd35e62896010cd9ff	no	I am sick longer with everything than anyone at my work .
8bf1211fd4b7b94528899de0a43b9fb3	no	Got to be one of the best games . So annoying when you cant get the candy to move . Good game .
a02ffd91ece5e7efeb46db8f10a74059	no	Like all of the other post's here i too would lie to know if uncle Doug is OK ...
bca82e41ee7b0833588399b1fcd177c7	no	When your hair eats more food than you do between it getting in your food , spilling food on it , and putting ""food"" in it
00ec53c4682d36f5c4359f4ae7bd7ba1	no	I know I've written on here already , but I thought I would add this , my daughter was 18mths old when she was diagnosed ( usually they don't diagnose until 2yrs , but strong family link ) I remember her in the car seat as an 18mth baby alright one min not the next , so foot down to a/e which was couple of mins away , luckily she was ok , but a frightening moment and a few after that , scary a couple of yrs ago too , now an adult but what she was presenting sounded like me , we're both asthmatics but I also suffer with spontaneous pneumothorax , and my daughter had a mucus block in her lungs which also stops your lung from working , she was in resus and again luckily pulled through , also when my youngest when 3 wks old he wasn't feeding properly and looked like he had difficulty because of breathing , I asked an out of hrs dr was it bronchiolitis ( as another baby that was in contact with my older children was in hospital a few weeks before with it , then my daughter caught a cough and cold , w ...
4f6ffe13a5d75b2d6a3923922b3922e5	yes	Hey guys check out my new app geendot on the play store﻿
beed13602b9b0e6ecb5b568ff5058f07	yes	Best areas to work around Nottingham are Broxtowe and St Ann's . Avoid West Bridgford .
0584ce565c824b7b7f50282d9a19945b	no	My first cars had a handle to start the engine . We have one or two Field Marshalls round and a Lanz . Peter
dc912a253d1e9ba40e2c597ed2376640	no	Great review . I was looking for a new mover for a while and Home Depot just had a sale for $400 with electric starter . Thanks for helping me with decision to buy Honda .﻿
39461a19e9eddfb385ea76b26521ea48	no	Hey josh , why do hypervenoms always rip at the front , please answer﻿
8efb100a295c0c690931222ff4467bb8	no	Well , for one , I can't get rdio on my mp3 player that i use for running .
d9fc5b73a8d78fad3d6dffe419384e70	no	I must say I've never had a pulley running out of true ... disintegrated , loose on the crankshaft , yes . A strange one , right enough ! Do post back when it's sorted . John
c86a7ee3d8ef0b551ed58e354a836f2b	no	Very informative and friendly staff especially MR Ahmad faiz %0AThan
a01a0380ca3c61428c26a231f0e49a09	no	If only my uber rating is same as my GPA
5a4b25aaed25c2ee1b74de72dc03c14e	no	Thanks for the encouragement . I am enjoying as much time as possible with her , and I know it means more to her than anything else . I feel the same way . I will keep updating as the news comes in .
f73b76ce8949fe29bf2a537cfa420e8f	no	Roberta , I am so sorry that your father has died . It sounds like he was a very great man and will be missed by many in the medical community of Brasil as well as by family and friends . You are in my thoughts and prayers during this painful time . AbraÃ§os ,
70c639df5e30bdee440e4cdf599fec2b	no	I put in three too . Like hell I'm going to decide .
28f0b864598a1291557bed248a998d4e	yes	More tickets collection machines would be better and also more snacks kiosks
1543843a4723ed2ab08e18053ae6dc5b	no	hi did you run this bye ESL ? because you used clips directly from their live stream . I may have to contact them about this ...﻿
f8c1f23d6a8d8d7904fc0ea8e066b3bb	no	This is exactly why employment rights for low-wage earners such as Uber or Deliveroo drivers are so important . They all have an , 'I'm alright Jack' mentality when things are going ok for them , but cry when things inevitably go wrong .
e46de7e1bcaaced9a54f1e9d0d2f800d	no	only one word BRILLIANT 10/10
b7b16ecf8ca53723593894116071700c	no	May i ask how you got this bacteremia ? i see that you don't have an IV line for PH .
352fe25daf686bdb4edca223c921acea	no	Even if this guy resides in the terminal , he is still wasting his time .
18d8042386b79e2c279fd162df0205c8	no	My problem is repeated pneumonia I can't seem to shift the inflammation that it causes and after a routine chest xray because of a fall they discovered a shadow on my right lung that they were very concerned about . It's turned out thankfully to be inflammation and have to have another CT scan to see if it's gone but it seems you can go about exercising etc and not even know it's there apart from tiredness and having to use the blue inhaler all the time which isn't really unusual for me anyway . Really not sure where to go with this I've never smoked and have been a runner and exercise instructor for 32 year's and feel like a 60 a day smoker !!!!
816b112c6105b3ebd537828a39af4818	no	That's a very general statement . Remember he blocked a shot from Ronaldo today 1 x 1 . When a player cuts away and takes a shot like that from that distance , it's not easy to block it . Pique also has long legs and can be slow to react in those situations . Always been that way .
69cb3ea317a32c4e6143e665fdb20b14	no	@MartyCL So you are saying Leica will sell maybe a dozen of them . Brilliant !!!
bbf94b34eb32268ada57a3be5062fe7d	no	Hi Joan . I'm suffering from moderate pain in the back . I think is pleuritic pain . I told my doc but no answer . Is it normal in PAH ?
4f4adcbf8c6f66dcfc8a3282ac2bf10a	yes	@Alan_Quintero24 That's definitely not OK , Alan . Please DM us the email address linked to your account and a member
bbcbff5c1f1ded46c25d28119a85c6c2	no	+Laxus Dreyar What about the HTC One M8 ? That thing's design is beautiful .
8cb22bdd0b7ba1ab13d742e22eed8da2	no	It's been 5 months since my husband has lung surgery and chest wall resection . The surgeon said he removed the large tumour and 3 ribs + nodes . He had a CT scan in head in October because his right eye looked like it was drooping . They said head was clear but he has started getting lots if headaches and his speech intermittently is slurred . He also loses his footing now and again and has slipped over . Does anyone know if mets to brain happens quickly ? As it didn't show up in October . He is not having a CT scan on lungs till April because he had so much work done internally the surgeon said they wouldn't be able to see anything . D
f4f6dce2f3a0f9dada0c2b5b66452017	yes	My wife is also taking Chemo and experiences severe general body pain and bone pain after the second day and it lasts for 2 , 3 , or 4 days . She takes Oxycontin 10 mg and Oxy IR 5 mg to control the pain . The Onocologist has told us she can take 20 mg oxycotin every 12 hrs and the oxy IR , up to 15 mgs every 2 hrs . The key here is to prevent pain , if it starts you chase it to control it . CAUTION , ASK HER ONOCOLOGIST WHAT DOSE SHE CAN TAKE , different meds may work better for her . In addition , this is the hardest to say , She must have the desire to fight , its her battle .
0d0fd7c6e093f7b804fa0150b875b868	no	Fix root Would be 5 stars off it worked with root . I revived root to be able to use Pay and out works fine . But one off the reasons I'm partial to Android is root . Easy rooting makes Android special . If I can't root I might be inclined to try an iPhone . Full Review
a96b65a721e561e1e3de768ac819ffbb	yes	I think that Real is improving a lot in terms of services , but I had an idea that could move real cinema into a new level . %0A1- build a partnerships with Emirates Airlines %0A2- allow passengers to watch new Real Cinema movies on the flight but with charges %0A3- profite can be split depending on agreement with emiraties airlines %0A4- I personally would love to have popcorn while traveling and enjoy a new released movie .
1068c6e4c8051cfd4e9ea8072e3189e2	no	Outrage ..? Have they starting rioting yet ? Told you a million times not to exaggerate !
17d63b1625c816c22647a73e1482372b	no	Within the space of 24hrs , two major car incidents have occurred in the Kensington area . One word missing from media reports ... Uber !!
b9228e0962a78b84f3d5d92f4faa000b	no	+free candy the bomb was allready planted
0deb1c54814305ca9ad266f53bc82511	no	I used the pre-loaded pens with Humira . I always found it was good to ice the area prior to injection and for a little bit afterward . Good luck !
66808e327dc79d135ba18e051673d906	no	He had some shortness of breath and severe edema but not to the extent he could not carry a bag of groceries in from the car .
42e7aaa88b48137a16a1acd04ed91125	no	Bull crap you're 10
8fe0093bb30d6f8c31474bd0764e6ac0	no	Manchester United manager Jose Mourinho lays out Champions League ambitions - #MUFC
41ae36ecb9b3eee609d05b90c14222fb	no	Reading a Cambridge myth and thinking ... does anyone here actually know any Latin ? It sounds cool , but it's a language I wouldn't waste my time learning because , well , it's dead
d1f255a373a3cef72e03aa9d980c7eca	no	Very interested about in this camera , but before I go any further I need to know if the new RX has the exact same lens as the original RX1 ? Thank you
7eacb532570ff6858afd2723755ff790	no	Yes , I will do . In the next couple of days as soon as I get a chance .
b6f0479ae87d244975439c6124592772	no	Here another NR1605 affected ! Waiting for a solution ...
e0c641195b27425bb056ac56f8953d24	no	I've been using this app for the past couple of months now . Securing payment on the spot rather than sending an email with account details prevents buyers remorse setting in and means a stronger business . Card Reader on the way now so I can't wait to use that .
f85454e8279be180185cac7d243c5eb3	no	It worked well for me except I started getting upper resp infections ! Ugh !
faa9afea49ef2ff029a833cccc778fd0	no	as much as i would love this to happen i cant see it as we have been asking for this for months . 0
3c7781a36bcd6cf08c11a970fbe0e2a6	yes	@seanpaulday @TfLTPH @TfL The orgs need to take p4h to court , we have nothing to lose , its already being abused by minicab firms like uber .
25b2822c2f5a3230abfadd476e8b04c9	no	Still had two asthma attacks after being out and one before . Inhaler did the trick though .
6ecbdd6ec859d284dc13885a37ce8d81	no	She was on Slidenifil for a while but caused serious issues with her eyes . I asked pulmo dr . about other drugs I'd read about on the boards and he said he had to be very careful with her because of her age ( now 87 ), and the possibility of some of them interfering/counteracting other meds
18997733ec258a9fcaf239cc55d53363	no	very pleased with product and service ,
8d7d8ee069cb0cbbf816bbb65d56947e	no	+Ben Watts hey josh do shin guards affect the sock ?
75fc093c0ee742f6dddaa13fff98f104	no	I suspect the lifespan of Sears will be shorter than that of your Apple Watch .
f74909ace68e51891440e4da0b65a70c	no	I'm not even a Man U fan but after watching this video I kinda want to be one
66368270ffd51418ec58bd793f2d9b1b	no	Anyone watching An Inspector Calls on BBC1 ? An amazing adaptation of one of my favourite plays
248e844336797ec98478f85e7626de4a	no	I really have appreciated reading all these comments from everyone today . It has been a big help to me . THANK YOU
019d385eb67632a7e958e23f24bd07d7	no	Josh , I currently am looking to purchase a pair of Superflys ( intense heat version ) but I can't find any in size 6 that are in stock and available , do you know any stores/websites that I could purchase them from . I can also fit a 5 . 5 size . Can u get back to me quickly ? Thanks- Connor﻿
a49e9411d64ff53eccfdd09ad10a15b3	no	#Inter Coach Luciano Spalletti says #MUFC target Ivan Perisic will play more than others in China .
ddb30680a691d157187ee1cf9e896d03	yes	Log into face book from the phone's facebook app . Mine asked me the first time if I wanted to import contacts . If your logged in and still no contacts , go to settings>accounts& sync and make sure facebook has a green icon next to is and says ""sync is ON""
2421fcb1263b9530df88f7f002e78ea5	no	That it is ... Well worth the 10 a month
fccb60fb512d13df5083790d64c4d5dd	no	Yeah @notbanksy got an Android too . Nothing against them . My HTC Ones ( M7 & M8 ) were great phones .
1651cf0d2f737d7adeab84d339dbabd3	no	Climbing into the back of the car ... Does it look as if the door card will come off , or is it tucked under the door inner itself ? John
eed5af6add95a9a6f1252739b1ad8c24	no	I'm ok reading . It's the writing test that worry me . Any incentive for that test ?
a8abb4bb284b5b27aa7cb790dc20f80b	yes	Like the other poster said earlier - take lots of detailed pics .
15d4e891d784977cacbfcbb00c48f133	no	Good fun
c203d8a151612acf12457e4d67635a95	yes	NIP SO STRONG RIGHT NOW !!! Keep going guys !
13f3cf8c531952d72e5847c4183e6910	no	Good &w
550a141f12de6341fba65b0ad0433500	no	Congrats on being one of the last signs up before the service shuts down later this week )
67f7fb873eaf29526a11a9b7ac33bfac	no	Thank you .
1a5b1e4daae265b790965a275b53ae50	no	Spa unit size and broucher unit size were not same and really i confused . I dont know why . Also floor plan in broucher and spa were not same .
9a96876e2f8f3dc4f3cf45f02c61c0c1	no	Love it . What a fabulous app !
9b70e8fe62e40c570a322f1b0b659098	no	Hi All , just wanted to give you a quick update on what's going on in here . My Mother in law agreed to have a second opinion and we are now scheduled to have a meeting in a private cancer center in Milan next week . At the same time I was able to have a look at her medical chart . She was told from her doctors that SCLC ""has grown a bit"" while for what I have read it is stated ""PD - which stands for progressive disease- +25%, + a new 1 mm hypodense liver lesion + hepatomegaly- The doctor wrote already in April when chemo was prescribed that it was palliative even if the cancer was considered LD She is now thinking about moving to our house , as her family ( husband and 2 daughters ) is very protective , but at the same time she doesn't have anybody helping her at home ( she still have to cook for them all and to take care for everything at home ) and she needs to rest as much as she can . I know exactly what expects us if she is moving . Years ago I used to work as a voluteer in an hospice , but this is not exactly the same . It makes such a big difference when someone you love gets involved ... So , let's wait for the scheduled meeting with the new doc . I really don't know how she will react if he will be outspoken and tell her all the truth but to me she has the right to know everything .
d61e4bbd6393c9111e6526ea173a7c8b	no	My daughter has used her credit card once as confirmed by her bank in a High St travel agent in September and was used last week 200 miles away to its max , thankfully she is in the police and was on duty so could not have been up north where the offence was committed , but the distress is still the same .
f5f8590cd58a54e94377e6ae2eded4d9	no	Our uber driver just told us we remind him of dolphins because we're giggly . Lmao #Imhonored
941e1aaaba585b952b62c14a3a175a61	no	I'll miss him ?? Pogba will miss him too ????
9431c87f273e507e6040fcb07dcb4509	no	I should really get a move on . Haven't really even started my personal statement . Posted from TSR Mobile
49ae49a23f67c759bf4fc791ba842aa2	no	Sukaina Rizvi , Asthma is a very frightened thing . I seem to be on steroid tablets most of the time . X
e44fea3bec53bcea3b7513ccef5857ac	no	My account is also being unsubscribed until a WP8 application is released .
821fa74b50ba3f7cba1e6c53e8fa6845	no	#Mourinho Fuming With #ManUtds Lack Of Transfer Activity With Just One Of Four Targets Secured ----
250cf8b51c773f3f8dc8b4be867a9a02	yes	Maybe you can try to use another roms , or get an app to enlarge your volume . If it still not so good , I think you should repair the hardware .
42998cf32d552343bc8e460416382dca	no	That's funny because I formatted my HDD last week and the only driver I installed was a beta version of my GPU drivers which then keep themselves up to date anyway . It's a problem hugely blown out of proportion by peasants imo .
d07e70efcfab08731a97e7b91be644de	no	Thanks Teresa . I dunno why but I may estimate why .
7fe1f8abaad094e0b5cb1b01d712f708	no	This hasn't put me off ever buying a VAG car in the future . Tell me anyone that buys a car to do with pollution levels anyway unless it is to get around cheap car tax or company car tax rules . Where there is blame there is a claim . 1st world issues imo .
98b297950041a42470269d56260243a1	no	@harsh6363 @Uber_India Nothing , except annoying customers . -/
0353ab4cbed5beae847a7ff6e220b5cf	no	Amazing and strong connection
51d92be1c60d1db1d2e5e7a07da55b26	no	La Liga Transfer News Barcelona wanted Real Madrid raid , Gareth Bale #MUFC #ManU #ManUtd #GGMU #FNH
428fca9bc1921c25c5121f9da7815cde	no	I posted this on another discussion , not realising I was going off topic on it . So I thought I would be best to start a discussion all of my own . Sorry to the original discussion starter . I am in a similar predicament and seem to have had a service similar to others taking a long time to get a diagnosis . Over two years of traipsing to the doctors and back . Very quickly diagnosed with depression , took all of 5 minutes to come up with this , after all what else could cause fatigue ? Repeated visits to the doctor just reinforced his opinion and said that I was now showing characteristics of anxiety . Just up the dose of sedating meds was the answer . Now diagnosed with sclc , but the two years of depression/anxiety and accompanying fatigue/non specific symptoms is not related to the diagnosis of cancer says the doctor . Should I believe him ? Ray
f1b6f2857fb6d44dd73c7041e0aa0f19	yes	Its really not the same for any one person . Some people are taken too soon , while others are living and functioning as close to normal as possible , and can do so for decades . There is no 'typical' path . Create your own !
68ce199ec2c5517597ce0a4d89620f55	no	it's so stupid how a lot of these pro players do this fancy jumping around with knife out . like what's the point , it's just more of an opportunity for the other team to get you off guard .﻿
e836d813fd184325132fca8edcdfb40e	yes	No , I was getting at that most people have it in their heads that it's hard to build a PC when it really isn't ... all you need to do is look at a YouTube video . I wasn't bashing anyone .
ab817c9349cf9c4f6877e1894a1faa00	no	Poor Lad , To be fair though even if he was on his game the cobble match was still going to be a loss .﻿
877a9ba7a98f75b90a9d49f53f15a858	no	I've been called a lot worse so thanks for that ! xx
dc6a6489640ca02b0d42dabeb8e46bb7	no	Amazing colors . I love the sky reflection .
26337353b7962f533d78c762373b3318	no	Lukaku's transfer to #MUFC moves a step closer as the striker completes his medical in Los Angeles . #TransferNews
8e6b42f1644ecb1327dc03ab345e618b	no	VICE did it
ef575e8837d065a1683c022d2077d342	no	I've worked a number of places where the reqs were communicated verbally , no written docs . Or at least some of the reqs . But something like this ? There is an email or other document where somebody told an engineer to do this . If not , then the s/w engineers are fools or idiots . There is no way I would ever put such code into a product , and if I did it would only be with some kind of document with a signature . This CEO is setting himself up to look like either an idiot or a villain trying to cover up for his bosses/colleagues by saying this . Some s/w engineer is going to present evidence to the contrary , or the investigation is going to find a whistle-blower . This is typical though - the bosses want something unethical or stupid done , and then they lay the blame on their underlings .
2050e03ca119580f74cca14cc6e97462	no	I don't believe the Co-Star has an IR receiver . That's the reason I elected to just get another Revue instead . Sure it's older , but it works great with my Harmony remotes . yeah thats what I was afraid of i couldnt find any information about it having an IR or RF receiver , I can live with it there is always the option of using my phone as a remote
25ddc0f8c9d3e22e03d3076f98d83cb2	no	There is nothing in the file info that would indicate an issue . Can you provide the plex media server . log showing you trying to play this file ?
5ef0b4eba35ab2d6180b0bca7e46b6f9	no	Sometimes I feel exactly same
598b3e71ec378bd83e0a727608b5db01	no	True . Thus blocking him/her . Hurts my hears listening to all the utter garbage and lies he/she comes out with lol ...
74071a673307ca7459bcf75fbd024e09	no	Mandy Bowers I need this ... you me and Georgie xxx
cfee398643cbc3dc5eefc89334cacdc1	no	This is Timon , my little brother who was born with a bit too much cuteness . @Uber_India #UberPUPPIES
